{
  "fixture_id": "GX-01",
  "purpose": "A clean ATH-anchored descending log line with one selected envelope second anchor and no breakout; end state ACTIVE.",
  "category": "normal valid",
  "spec_refs": ["§3", "§4", "§5", "§6", "§7", "§8", "§11", "D-TL-04"],
  "input_convention": {
    "timestamp_kind": "ordinal",
    "bar_count": 19,
    "price_field_for_geometry": "high",
    "adjustment_basis": "split-adjusted, dividend-unadjusted (as-traded)"
  },
  "params": {
    "k": 3,
    "eps": 0.02,
    "eps_touch": 0.01,
    "eps_break": 0.01,
    "eps_break_locked": false,
    "eps_break_note": "eps_break is illustrative, not locked (HD-03, §13.5); versioned/backtestable.",
    "tolerance_version": "tol-2026.07-illustrative"
  },
  "expected_ath_anchor": { "t": 0, "H": 100.00 },
  "expected_second_anchor": { "t": 12, "H": 88.00 },
  "expected_log_slope": -0.0106528,
  "expected_intercept": 4.60517,
  "expected_line_values": {
    "0": { "y_hat": 4.60517, "line": 100.000 },
    "6": { "y_hat": 4.54125, "line": 93.8085 },
    "12": { "y_hat": 4.47734, "line": 88.0000 },
    "18": { "y_hat": 4.41342, "line": 82.5516 }
  },
  "expected_state_transitions": [
    { "bar": 12, "from": "NONE", "to": "ACTIVE", "reason_code": "LINE_ESTABLISHED" }
  ],
  "expected_final_state": "ACTIVE",
  "breakout_bar": null,
  "confirmed_bar": null,
  "expected_reason_codes": ["LINE_ESTABLISHED"],
  "flags": [],
  "rejection_rationale": [
    {
      "candidate": "B=(6,92) as second anchor",
      "rejected_because": "The A->(6,92) line is shallower but the t=12 bar high (88) pierces it beyond eps, so it is NOT envelope-valid.",
      "numeric": "m_6=(ln92-ln100)/6=(4.521789-4.605170)/6=-0.0138968; y_hat_6(12)=4.605170-0.0138968*12=4.438408; ln88=4.477337 > 4.438408+0.02=4.458408 -> pierces."
    },
    {
      "candidate": "Any bar-high piercing the selected A->(12,88) line",
      "rejected_because": "No bar high after t=0 exceeds line+eps; structure holds, so no INVALID_PIERCE and no recompute.",
      "numeric": "max intervening high is t=6 H=92 (ln=4.521789) vs line(6)=93.8085 (y_hat=4.54125); 4.521789 < 4.54125 -> dominated (not even within eps of piercing)."
    },
    {
      "candidate": "Any breakout (ACTIVE->BROKEN_OUT)",
      "rejected_because": "No daily close exceeds line+eps_break anywhere in the series.",
      "numeric": "highest post-anchor close is t=6 C=91 (ln=4.51086) vs line(6) y_hat=4.54125; 4.51086 < 4.54125+0.01 -> no candidate."
    }
  ],
  "geometry_check": {
    "yA": 4.60517,
    "yB": 4.47734,
    "slope_formula": "m=(yB-yA)/(tB-tA)=(4.477337-4.605170)/(12-0)=-0.127833/12=-0.0106528",
    "intercept_formula": "b=yA-m*tA=4.605170-(-0.0106528*0)=4.605170",
    "key_inequalities": [
      "Candidacy is over ALL later bar highs (§6, D-TL-05) — not a pivot subset. The binding competitors are t=6 (H=92) and t=12 (H=88), which are also k=3 pivots (descriptive only, non-authoritative per §5/D-TL-03).",
      "Envelope: only (12,88) dominates every intervening BAR high; (6,92) fails on t=12. Checked over the full 19-bar history: no bar high lies above the A->(12,88) line (tightest approaches t=6 92 vs line 93.8085, t=11 87 vs 88.9425, t=16 83 vs 84.3293), so (12,88) is also the shallowest envelope-valid candidate.",
      "line(6)=exp(4.54125)=93.8085 >= H[6]=92 -> intervening high dominated.",
      "No close exceeds line+eps_break -> stays ACTIVE."
    ],
    "notes": "Anchor A is the earliest global-max high (t=0). B* is the shallowest descending line that dominates every intervening BAR high within eps (upper log-hull, D-TL-04/D-TL-05 as revised 2026-07-25; pivot status is not a precondition, HD-11). B* is unchanged by that revision."
  }
}
