{
  "fixture_id": "GX-18",
  "purpose": "A bar missing its high and a bar with a non-positive price make the input invalid; the detector rejects the bar-set and produces no geometry (INVALID_INPUT / INVALID_PRICE).",
  "category": "missing-data edge case",
  "spec_refs": [
    "§1",
    "§18",
    "§21.3"
  ],
  "input_convention": {
    "timestamp_kind": "ordinal",
    "bar_count": 8,
    "price_field_for_geometry": "high",
    "adjustment_basis": "split-adjusted, dividend-unadjusted (as-traded)"
  },
  "params": {
    "k": 3,
    "eps": 0.02,
    "eps_touch": 0.01,
    "eps_break": 0.01,
    "eps_break_locked": false,
    "eps_break_note": "eps_break is illustrative, not locked (HD-03, §13.5); versioned/backtestable. This fixture is verified robust across an eps_break sweep — see causal_record.eps_break_robustness.",
    "tolerance_version": "tol-2026.07-illustrative",
    "min_formation_bars": 8,
    "min_ath_age_bars": 3,
    "formation_params_note": "Formation gates are first-class, k-independent, versioned parameters (§21.3, D-TL-12): min_formation_bars replaces the pivot-derived 2k+2 and min_ath_age_bars replaces the k-recency window. Numerically unchanged at k=3."
  },
  "expected_ath_anchor": null,
  "expected_second_anchor": {
    "t": null,
    "H": null,
    "reason": "Geometry is not fit: the input guards of §18 reject the bar-set (INVALID_INPUT, INVALID_PRICE) before anchoring or fitting."
  },
  "expected_log_slope": null,
  "expected_intercept": null,
  "expected_state_transitions": [
    {
      "bar": 3,
      "from": "NONE",
      "to": "NONE",
      "reason_code": "INVALID_INPUT"
    },
    {
      "bar": 5,
      "from": "NONE",
      "to": "NONE",
      "reason_code": "INVALID_PRICE"
    }
  ],
  "expected_final_state": "NONE",
  "breakout_bar": null,
  "confirmed_bar": null,
  "expected_reason_codes": [
    "INVALID_INPUT",
    "INVALID_PRICE"
  ],
  "flags": [],
  "rejection_rationale": [
    {
      "candidate": "Fitting any line at any prefix",
      "rejected_because": "The §18 input guards reject the bar-set before anchoring or fitting, so no as-of-time line exists at any bar and no tolerance is ever consulted.",
      "numeric": "[\"INVALID_INPUT\",\"INVALID_PRICE\"]"
    }
  ],
  "geometry_check": {
    "yA": null,
    "yB": null,
    "slope_formula": "no line",
    "intercept_formula": "no line",
    "key_inequalities": [
      "Input guard (§18) fires before geometry: INVALID_INPUT, INVALID_PRICE. No prefix S_t ever yields a line, so §21 evaluation never begins."
    ],
    "notes": "Unchanged by the causal audit: input validity is checked before any prefix is evaluated, so no as-of-time line exists at any bar."
  },
  "causal_record": {
    "semantics": "As-of-time (rolling causal) evaluation per §21 / HD-12 / D-TL-11. Every value below is derived ONLY from bars strictly earlier than the bar it judges; no expectation here uses a full-series hull.",
    "input_guard": {
      "rejected": true,
      "codes": [
        "INVALID_INPUT",
        "INVALID_PRICE"
      ],
      "detail": null
    },
    "note": "Input guards (§18) reject the bar-set before any geometry is fitted, so no as-of-time line exists at any prefix."
  }
}
